{
  "$schema": "https://json-schema.org/draft/2020-12/schema",
  "title": "Loop Result",
  "type": "object",
  "required": [
    "task_id",
    "result_id",
    "created_at",
    "status",
    "summary",
    "files_changed",
    "commands_run",
    "tests",
    "blockers",
    "next_suggestions"
  ],
  "properties": {
    "task_id": {
      "type": "string"
    },
    "result_id": {
      "type": "string"
    },
    "created_at": {
      "type": "string"
    },
    "status": {
      "type": "string",
      "enum": ["success", "partial_success", "blocked", "failed"]
    },
    "summary": {
      "type": "string"
    },
    "files_changed": {
      "type": "array",
      "items": {
        "type": "string"
      }
    },
    "commands_run": {
      "type": "array",
      "items": {
        "type": "object",
        "required": ["command"],
        "properties": {
          "command": { "type": "string" },
          "exit_code": { "type": ["integer", "null"] },
          "summary": { "type": "string" }
        },
        "additionalProperties": true
      }
    },
    "tests": {
      "type": "array",
      "items": {
        "type": "object",
        "required": ["name", "status"],
        "properties": {
          "name": { "type": "string" },
          "status": { "type": "string" },
          "details": { "type": "string" }
        },
        "additionalProperties": true
      }
    },
    "blockers": {
      "type": "array",
      "items": {
        "type": "string"
      }
    },
    "next_suggestions": {
      "type": "array",
      "items": {
        "type": "string"
      }
    }
  },
  "additionalProperties": true
}
