{
  "task_id": "task-001",
  "result_id": "result-001",
  "created_at": "2026-04-09T00:30:00Z",
  "status": "partial_success",
  "summary": "The startup crash was fixed, but a secondary configuration regression remains in a related path.",
  "files_changed": [
    "src/core/init.py",
    "tests/test_core_init.py"
  ],
  "commands_run": [
    {
      "command": "pytest tests/test_core_init.py",
      "exit_code": 0,
      "summary": "Targeted initialization test passed."
    },
    {
      "command": "pytest tests/test_config.py",
      "exit_code": 1,
      "summary": "Configuration edge case still fails."
    }
  ],
  "tests": [
    {
      "name": "tests/test_core_init.py",
      "status": "passed",
      "details": "Initialization path is now stable for the tested case."
    },
    {
      "name": "tests/test_config.py",
      "status": "failed",
      "details": "Empty configuration still triggers an exception."
    }
  ],
  "blockers": [
    "Configuration fallback behavior is still incomplete."
  ],
  "next_suggestions": [
    "Create a focused task for empty-config fallback handling.",
    "Add a regression test for missing configuration values."
  ]
}
